{
  "schema_version": 1,
  "record_kind": "recorded_model_execution",
  "attempt_id": "design-claude-03",
  "recorded_at": "2026-10-19T02:22:34.131Z",
  "executor": {
    "vendor": "anthropic",
    "service": "aws-bedrock",
    "adapter": "claude-collaborator",
    "revision": null
  },
  "requested": {
    "model_selector": "opus",
    "settings": {
      "claude_collaborator.effort": "high"
    },
    "configuration_history_ref": null
  },
  "observed": {
    "metadata_source": "Claude Collaborator returned metadata",
    "model_id": "claude-opus-5-5",
    "model_revision": null,
    "provider_request_id": null,
    "effective_settings_known": false,
    "configured_route": "us.anthropic.claude-opus-5-5",
    "reported_settings": {
      "claude_collaborator.configured_effort": "high",
      "claude_collaborator.thinking": "adaptive"
    },
    "usage": {
      "input_tokens": 1387,
      "output_tokens": 3746,
      "cache_creation_input_tokens": 0,
      "cache_read_input_tokens": 0
    },
    "stop_reason": "end_turn",
    "truncated": false
  },
  "inputs": {
    "request_record_ref": "docs/collaboration/requests/claude-03.json",
    "source_exposure": "Coordinator's actual implementation and source-review summaries, implementer's proposed context shapes, and latest user instruction deferring GitHub. No direct repository access; earlier responses summarized rather than resent.",
    "context_pack_ref": null,
    "source_snapshot_ref": null
  },
  "status": "completed",
  "output_ref": "docs/collaboration/2026-10-19-claude-03.md",
  "limitations": [
    "Recorded after execution; precise provider start/end time was not captured.",
    "Reported model identity is not proof of internal weights.",
    "No raw hidden reasoning captured.",
    "Usage is tool-reported, not independently metered.",
    "This review contains retained coordinator corrections; see collaboration README."
  ]
}
